{
  "schema_version": "0.1.0-draft",
  "event_id": "123e4567-e89b-42d3-a456-426614174020",
  "task_id": "123e4567-e89b-42d3-a456-426614174000",
  "sequence": 1,
  "occurred_at": "2026-10-31T00:00:02Z",
  "type": "task.created",
  "state": "queued",
  "origin": {
    "kind": "local",
    "display_label": "This device"
  },
  "step": null,
  "progress": null,
  "approval": null,
  "result": null,
  "error": null,
  "evidence_refs": [],
  "correlation_id": "corr-123e4567"
}
